{
  "benchmark": "rayd_multi_device",
  "configs": {
    "compute": {
      "accum_dfr_direct": {
        "batch": "67108864 samples",
        "chunk_count": 2,
        "dispatch": "lane-sharded",
        "multi_ms": 18.83,
        "relative_grid_deviation": 2.9e-07,
        "single_ms": 34.76,
        "speedup": 1.85
      },
      "intersect": {
        "batch": "4194304 rays",
        "bitwise_agreement": 1.0,
        "chunk_count": 5,
        "dispatch": "pipelined",
        "multi_ms": 11.83,
        "single_ms": 19.09,
        "speedup": 1.61
      },
      "intersect_calibrated": {
        "batch": "4194304 rays",
        "chunk_count": 5,
        "dispatch": "pipelined",
        "multi_ms": 11.83,
        "single_ms": 19.08,
        "speedup": 1.61,
        "weights": [
          1.002,
          0.998
        ]
      },
      "intersect_offload": {
        "batch": "4194304 rays",
        "chunk_count": 8,
        "dispatch": "chunked",
        "multi_ms": 12.54,
        "peak_memory": {
          "status": "not_recorded"
        },
        "single_ms": 19.18,
        "speedup": 1.53
      },
      "max_bounces": 4,
      "note": "2.1M-triangle cloud, incoherent rays, 4 bounces, 67M samples -- compute-bound",
      "rays": 4194304,
      "trace_reflections": {
        "batch": "4194304 rays",
        "bitwise_agreement": 1.0,
        "chunk_count": 5,
        "dispatch": "pipelined",
        "multi_ms": 28.38,
        "single_ms": 53.33,
        "speedup": 1.88
      },
      "trace_reflections_calibrated": {
        "batch": "4194304 rays",
        "chunk_count": 5,
        "dispatch": "pipelined",
        "multi_ms": 28.45,
        "single_ms": 53.43,
        "speedup": 1.88,
        "weights": [
          1.0,
          1.0
        ]
      },
      "triangles": 2097152
    },
    "light": {
      "accum_dfr_direct": {
        "batch": "8192 samples",
        "chunk_count": 2,
        "dispatch": "lane-sharded",
        "multi_ms": 1.34,
        "relative_grid_deviation": 6.5e-08,
        "single_ms": 0.31,
        "speedup": 0.23
      },
      "intersect": {
        "batch": "4194304 rays",
        "bitwise_agreement": 1.0,
        "chunk_count": 5,
        "dispatch": "pipelined",
        "multi_ms": 4.63,
        "single_ms": 1.27,
        "speedup": 0.27
      },
      "intersect_calibrated": {
        "batch": "4194304 rays",
        "dispatch": "master",
        "multi_ms": 1.22,
        "single_ms": 1.22,
        "speedup": 1.0,
        "weights": [
          0.487,
          0.0
        ]
      },
      "intersect_offload": {
        "batch": "4194304 rays",
        "chunk_count": 8,
        "dispatch": "chunked",
        "multi_ms": 4.48,
        "peak_memory": {
          "status": "not_recorded"
        },
        "single_ms": 1.27,
        "speedup": 0.28
      },
      "max_bounces": 1,
      "note": "192-vertex grid (72,962 triangles), 1 bounce, small sample count -- transfer-bound",
      "rays": 4194304,
      "trace_reflections": {
        "batch": "4194304 rays",
        "bitwise_agreement": 1.0,
        "chunk_count": 5,
        "dispatch": "pipelined",
        "multi_ms": 2.26,
        "single_ms": 1.14,
        "speedup": 0.5
      },
      "trace_reflections_calibrated": {
        "batch": "4194304 rays",
        "dispatch": "master",
        "multi_ms": 1.1,
        "single_ms": 1.09,
        "speedup": 1.0,
        "weights": [
          1.186,
          0.0
        ]
      },
      "triangles": 72962
    }
  },
  "machine": {
    "cuda": "13.0",
    "d2d_gbps": 49.1,
    "device_count": 2,
    "devices": [
      {
        "index": 0,
        "name": "NVIDIA RTX A6000"
      },
      {
        "index": 1,
        "name": "NVIDIA RTX A6000"
      }
    ],
    "peer_access": {
      "pairs": [
        {
          "can_access": true,
          "destination": 1,
          "source": 0
        }
      ],
      "status": "partially_recorded"
    },
    "torch": "2.13.0+cu130"
  },
  "parameters": {
    "accum_only": false,
    "calibration_rays": 0,
    "calibration_repeats": 3,
    "repeat": 7,
    "selected_configs": [
      "light",
      "compute"
    ],
    "warmup": 2
  },
  "provenance": {
    "generated_at": "2026-07-28T00:00:00Z",
    "kind": "historical_documentation_import",
    "measured_at": "2026-07-27",
    "source_documents": [
      "docs/adr/0038-replicated-multi-device-execution.md#measured-results",
      "docs/dev/multi_gpu_operations.md#51-measured-2026-07-27"
    ],
    "statement": "Transcribed from the already documented 2026-07-27 run of record; this file is not a new benchmark execution. Peak-memory values were not present in the historical source and are explicitly marked not_recorded. The historical benchmark checked peer access only from cuda:0 to cuda:1, so the reverse direction and all-pairs status are not asserted."
  },
  "schema_version": 1
}
